{
  "format_version": 2,
  "id": "PV-1",
  "title": "Função iniciais",
  "complexity": "bounded",
  "needs_ui": false,
  "task": "Exportar iniciais(nome) em src/nomes.mjs: a primeira letra maiúscula de cada palavra, ignorando espaços extras.",
  "workspace": { "kind": "git", "root": "." },
  "risk": { "level": "normal", "surfaces": [], "evidence": [] },
  "guardrails": { "scope_paths": ["src/**", "test/**"], "do_not_touch": [".ade/**"], "autonomy": "safe" },
  "requirements": [{ "id": "R1", "ears": "WHEN iniciais recebe um nome THE SYSTEM SHALL devolver a primeira letra maiúscula de cada palavra." }],
  "scenarios": [{ "id": "C1", "given": "um nome com espaços extras", "when": "iniciais é chamada", "then": "a prova do exemplo passa", "verifiers": ["E1"], "evals": ["E1"] }],
  "verifiers": [{ "id": "E1", "kind": "script", "cmd": ["node", "test/run.mjs"], "expect_exit": 0, "timeout_s": 120, "max_output_bytes": 65536, "evidence": ["test/nomes.test.mjs"], "strictness": { "mode": "must_fail_before" }, "author": "operator" }],
  "evals": [{ "format_version": 1, "id": "E1", "kind": "script", "cmd": ["node", "test/run.mjs"], "expect_exit": 0, "timeout_s": 120, "max_output_bytes": 65536, "evidence": ["test/nomes.test.mjs"], "strictness": { "mode": "must_fail_before" }, "author": "operator" }],
  "skills": [],
  "roles": { "maker": { "family": "claude", "model_id": "claude-sonnet-5" }, "checker_round": { "family": "codex", "model_id": "gpt-5.6-terra" } },
  "budget": { "max_model_calls": 6, "max_rework_rounds": 2 }
}
